{
  "schema": "docara.declarative_example.v1",
  "id": "product-smart-runtime",
  "title": "Product Smart-компоненты Docara",
  "description": "Бренд, четырёхуровневая навигация и содержание страницы собраны из canonical Smart-компонентов с собственными assets.",
  "category": "smart",
  "order": 58,
  "result_page": "content/demonstrator-results/product-smart-runtime.md",
  "preview": "tall",
  "sources": [
    {"label": "Markdown результата", "path": "content/demonstrator-results/product-smart-runtime.md", "language": "markdown"},
    {"label": "Композиция страницы", "path": "content/demonstrator-results/product-smart-runtime.page.json", "language": "json"}
  ]
}
