{
  "schema": "docara.declarative_example.v1",
  "id": "region-aside",
  "title": "Aside с контекстом страницы",
  "description": "Правая область объединяет автоматически построенное оглавление и информационный Smart-компонент.",
  "category": "regions",
  "order": 16,
  "result_page": "content/demonstrator-results/region-aside.md",
  "preview": "tall",
  "sources": [
    {"label": "Markdown страницы", "path": "content/demonstrator-results/region-aside.md", "language": "markdown"},
    {"label": "Композиция aside", "path": "content/demonstrator-results/region-aside.page.json", "language": "json"}
  ]
}
